{
  "id": "python-sqlalchemy-alembic",
  "title": "Add SQLAlchemy models + Alembic migrations",
  "category": "data-layer",
  "version": "1.0.0",
  "summary": "Adds a SQLAlchemy declarative Base, engine/session setup, and Alembic migration scaffolding to a Python backend that has neither yet.",
  "variables": [
    {
      "name": "packageName",
      "prompt": "Python package/module name for the application (e.g. app)",
      "default": "app"
    },
    {
      "name": "databaseUrlEnvVar",
      "prompt": "Environment variable name holding the database URL",
      "default": "DATABASE_URL"
    }
  ],
  "forkedFrom": {
    "id": "python-sqlalchemy-alembic",
    "version": "1.0.0"
  }
}
